<?xml version="1.0" encoding="UTF-8" ?>

<channel_map xmlns:xsi="http://www.w3.org/2001/XMLSchema-instance"
             xsi:noNamespaceSchemaLocation="schema/channel_map.xsd">

  <!--________________________________________________________________-->
  <DAQNode node_id="1" name="k18eb">
    <!--________________________________________________________________-->
    <VmeMaster node_id="0x201" name="vme01">
      <VmeRm address="0xff010000">
    	<for var="ch" from="0" to="1"><for var="data" from="0" to="3">
    	  <FE ch="ch" data="data">
    	  <D Device="VME-RM" Plane="vme01" ch="ch" data="data"/></FE>
    	</for></for>
      </VmeRm>
      <VmeCaenV792 address="0xad010000">
    	<for var="ch" from="0" to="25">
    	  <FE ch="ch"><D Device="VMEdummy" plane="0" segment="ch" data="0"/></FE>
    	</for>
	<FE ch="26"><D Device="BAC" segment="0" ch="0" data="0"/></FE>
	<FE ch="27"><D Device="BAC" segment="1" ch="0" data="0"/></FE>
        <FE ch="28"><D Device="PVAC" segment="0" ch="0" data="0"/></FE>
        <FE ch="29"><D Device="FAC" segment="0" ch="0" data="0"/></FE>
    	<for var="ch" from="30" to="31">
    	  <FE ch="ch"><D Device="VMEdummy" plane="0" segment="ch" data="0"/></FE>
    	</for>
      </VmeCaenV792>
      <VmeCaenV792 address="0xad020000">
	<for var="ch" from="0" to="4">
	  <FE ch="ch*2"><D Device="BH2" segment="ch" ch="0" data="0"/></FE>
	</for>
	<for var="ch" from="5" to="15"><!-- VMEdummy -->
    	  <FE ch="ch*2"><D Device="VMEdummy" plane="1" segment="ch" data="0"/></FE>
    	</for>
      </VmeCaenV792>
      <VmeCaenV792 address="0xad030000">
        <for var="ch" from="0" to="16">
          <FE ch="ch"><D Device="TOF" segment="ch" ch="0" data="0"/></FE>
        </for>
        <FE ch="17"><D Device="VMEdummy" plane="2" segment="17" data="0"/></FE>
        <FE ch="18"><D Device="TOF" segment="18" ch="0" data="0"/></FE>
        <FE ch="19"><D Device="VMEdummy" plane="2" segment="19" data="0"/></FE>
        <FE ch="20"><D Device="TOF" segment="20" ch="0" data="0"/></FE>
        <FE ch="21"><D Device="VMEdummy" plane="2" segment="21" data="0"/></FE>
        <FE ch="22"><D Device="TOF" segment="22" ch="0" data="0"/></FE>
        <FE ch="23"><D Device="VMEdummy" plane="2" segment="23" data="0"/></FE>
        <FE ch="24"><D Device="TOF" segment="17" ch="0" data="0"/></FE>
        <FE ch="25"><D Device="VMEdummy" plane="2" segment="25" data="0"/></FE>
        <FE ch="26"><D Device="TOF" segment="19" ch="0" data="0"/></FE>
        <FE ch="27"><D Device="TOF" segment="21" ch="0" data="0"/></FE>
        <FE ch="28"><D Device="TOF" segment="23" ch="0" data="0"/></FE>
        <for var="ch" from="29" to="31">
          <FE ch="ch"><D Device="VMEdummy" plane="2" segment="ch" data="0"/></FE>
        </for>
      </VmeCaenV792>
      <VmeCaenV792 address="0xad040000">
        <for var="ch" from="0" to="4">
          <FE ch="ch"><D Device="TOF" segment="ch" ch="1" data="0"/></FE>
        </for>
        <FE ch="5"><D Device="VMEdummy" plane="3" segment="5" data="0"/></FE>
        <for var="ch" from="6" to="12">
          <FE ch="ch"><D Device="TOF" segment="ch" ch="1" data="0"/></FE>
        </for>
        <FE ch="13"><D Device="VMEdummy" plane="3" segment="13" data="0"/></FE>
        <for var="ch" from="14" to="16">
          <FE ch="ch"><D Device="TOF" segment="ch" ch="1" data="0"/></FE>
        </for>
        <FE ch="17"><D Device="VMEdummy" plane="3" segment="17" data="0"/></FE>
        <for var="ch" from="18" to="23">
          <FE ch="ch"><D Device="TOF" segment="ch" ch="1" data="0"/></FE>
        </for>
        <FE ch="24"><D Device="VMEdummy" plane="3" segment="24" data="0"/></FE>
        <FE ch="25"><D Device="VMEdummy" plane="3" segment="25" data="0"/></FE>
        <FE ch="26"><D Device="TOF" segment="5" ch="1" data="0"/></FE>
        <FE ch="27"><D Device="VMEdummy" plane="3" segment="27" data="0"/></FE>
        <FE ch="28"><D Device="TOF" segment="13" ch="1" data="0"/></FE>
        <FE ch="29"><D Device="TOF" segment="17" ch="1" data="0"/></FE>
        <FE ch="30"><D Device="VMEdummy" plane="3" segment="30" data="0"/></FE>
        <FE ch="31"><D Device="VMEdummy" plane="3" segment="31" data="0"/></FE>
      </VmeCaenV792>
      <VmeCaenV792 address="0xad050000">
    	<FE ch="0"><D Device="BH1" segment="0" ch="0" data="0"/></FE>
    	<FE ch="1"><D Device="BH1" segment="1" ch="0" data="0"/></FE>
    	<FE ch="2"><D Device="BH1" segment="2" ch="0" data="0"/></FE>
    	<FE ch="3"><D Device="BH1" segment="3" ch="0" data="0"/></FE>
    	<FE ch="4"><D Device="BH1" segment="4" ch="0" data="0"/></FE>
    	<FE ch="5"><D Device="BH1" segment="5" ch="0" data="0"/></FE>
    	<FE ch="6"><D Device="BH1" segment="6" ch="0" data="0"/></FE>
    	<FE ch="7"><D Device="BH1" segment="7" ch="0" data="0"/></FE>
    	<FE ch="8"><D Device="BH1" segment="8" ch="0" data="0"/></FE>
    	<FE ch="9"><D Device="BH1" segment="9" ch="0" data="0"/></FE>
    	<FE ch="10"><D Device="BH1" segment="10" ch="0" data="0"/></FE>
    	<for var="ch" from="11" to="15">
    	  <FE ch="ch"><D Device="VMEdummy" plane="0" segment="ch" data="0"/></FE>
    	</for>
    	<FE ch="16"><D Device="BH1" segment="0" ch="1" data="0"/></FE>
    	<FE ch="17"><D Device="BH1" segment="1" ch="1" data="0"/></FE>
    	<FE ch="18"><D Device="BH1" segment="2" ch="1" data="0"/></FE>
    	<FE ch="19"><D Device="BH1" segment="3" ch="1" data="0"/></FE>
    	<FE ch="20"><D Device="BH1" segment="4" ch="1" data="0"/></FE>
    	<FE ch="21"><D Device="BH1" segment="5" ch="1" data="0"/></FE>
    	<FE ch="22"><D Device="BH1" segment="6" ch="1" data="0"/></FE>
    	<FE ch="23"><D Device="BH1" segment="7" ch="1" data="0"/></FE>
    	<FE ch="24"><D Device="BH1" segment="8" ch="1" data="0"/></FE>
    	<FE ch="25"><D Device="BH1" segment="9" ch="1" data="0"/></FE>
    	<FE ch="26"><D Device="BH1" segment="10" ch="1" data="0"/></FE>
    	<for var="ch" from="27" to="31">
    	  <FE ch="ch"><D Device="VMEdummy" plane="0" segment="ch" data="0"/></FE>
    	</for>
      </VmeCaenV792>
    </VmeMaster>
    <!--________________________________________________________________-->
    <VmeMaster node_id="0x202" name="vme02">
      <VmeRm address="0xff020000">
      	<for var="ch" from="0" to="1"><for var="data" from="0" to="3">
      	  <FE ch="ch" data="data">
      	  <D Device="VME-RM" Plane="vme02" ch="ch" data="data"/></FE>
      	</for></for>
      </VmeRm>
      <VmeCaenV792 address="0x00110000">
	<!-- WC-U-1~20 -->
	<for var="ch" from="0" to="19">
	  <FE ch="ch"><D Device="WC" segment="ch" ch="0" data="0"/></FE>
	</for>
	<!-- WC-D-1~12 -->
	<for var="ch" from="0" to="11">
	  <FE ch="ch+20"><D Device="WC" segment="ch" ch="1" data="0"/></FE>
	</for>
      </VmeCaenV792>
      <VmeCaenV792 address="0x00120000">
	<!-- WC-D-13~20 -->
	<for var="ch" from="0" to="6">
	  <FE ch="ch"><D Device="WC" segment="ch+12" ch="1" data="0"/></FE>
	</for>
	<FE ch="31"><D Device="WC" segment="19" ch="1" data="0"/></FE>
	<!-- WC-SUM-1~20 -->
	<for var="ch" from="0" to="15">
	  <FE ch="ch+8"><D Device="WC" segment="ch" ch="2" data="0"/></FE>
	</for>
	<FE ch="24"><D Device="VMEdummy" plane="2" segment="24" data="0"/></FE>
	<for var="ch" from="17" to="19">
	  <FE ch="ch+8"><D Device="WC" segment="ch" ch="2" data="0"/></FE>
	</for>
	<FE ch="28"><D Device="VMEdummy" plane="2" segment="28" data="0"/></FE>
	<FE ch="29"><D Device="WC" segment="16" ch="2" data="0"/></FE>
	<!-- VMEdummy -->
	<FE ch="7"><D Device="VMEdummy" plane="2" segment="7" data="0"/></FE>
	<FE ch="30"><D Device="VMEdummy" plane="2" segment="30" data="0"/></FE>
      </VmeCaenV792>
    </VmeMaster>
    <!--________________________________________________________________-->
    <HulMHTdc node_id="0x611" name="hul02sdc-1">
      <for var="ch" from="0" to="63"><for var="data" from="0" to="2">
    	  <FE ch="ch" data="data"><D Device="SDC3" plane="0" ch="ch" data="data"/></FE>
      </for></for>
      <for var="data" from="0" to="3">
  	<FE ch="0" data="data + 3"><D Device="HUL-RM" plane="hul02sdc_1" ch="0" data="data"/></FE>
      </for>
    </HulMHTdc>
    <HulMHTdc node_id="0x612" name="hul02sdc-2">
      <for var="ch" from="0" to="63"><for var="data" from="0" to="2">
    	  <FE ch="ch" data="data"><D Device="SDC3" plane="0" ch="ch + 64" data="data"/></FE>
      </for></for>
      <for var="ch" from="64" to="127"><for var="data" from="0" to="1">
    	  <FE ch="ch" data="data"><D Device="SDC3" plane="1" ch="ch - 64" data="data"/></FE>
      </for></for>
    </HulMHTdc>
    <HulMHTdc node_id="0x613" name="hul02sdc-3">
      <for var="ch" from="0" to="63"><for var="data" from="0" to="2">
    	  <FE ch="ch" data="data"><D Device="SDC3" plane="1" ch="ch + 64" data="data"/></FE>
      </for></for>
      <for var="ch" from="64" to="127"><for var="data" from="0" to="1">
    	  <FE ch="ch" data="data"><D Device="SDC3" plane="2" ch="191 - ch" data="data"/></FE>
      </for></for>
    </HulMHTdc>
    <HulMHTdc node_id="0x614" name="hul02sdc-4">
      <for var="ch" from="0" to="63"><for var="data" from="0" to="2">
    	  <FE ch="ch" data="data"><D Device="SDC3" plane="2" ch="63 - ch" data="data"/></FE>
      </for></for>
      <for var="ch" from="64" to="127"><for var="data" from="0" to="1">
    	  <FE ch="ch" data="data"><D Device="SDC3" plane="3" ch="191 - ch" data="data"/></FE>
      </for></for>
    </HulMHTdc>
    <HulMHTdc node_id="0x615" name="hul02sdc-5">
      <for var="ch" from="0" to="63"><for var="data" from="0" to="2">
    	  <FE ch="ch" data="data"><D Device="SDC3" plane="3" ch="63 - ch" data="data"/></FE>
      </for></for>
      <for var="ch" from="0" to="31"><for var="data" from="0" to="1">
      	  <FE ch="ch * 2 + 64" data="data"><D Device="SDC4" Plane="x2" ch="ch" data="data"/></FE>
      	  <FE ch="ch * 2 + 65" data="data"><D Device="SDC4" Plane="x1" ch="ch" data="data"/></FE>
      </for></for>
    </HulMHTdc>
    <!--________________________________________________________________-->
    <HulMHTdc node_id="0x616" name="hul02sdc-6">